{
  "metadata": {
    "schema_version": "2.0",
    "content_version": "1.0",
    "revision": 1
  },
  "episode_id": "travel_new_york_city_ep001",
  "scene_id": "S011",
  "shot_id": "SHOT_003",
  "sequence": 3,
  "source_refs": {
    "production_scene": "02_visual/production_scenes/S011.json",
    "shot": "03_shots/S011/SHOT_003.json",
    "visual_continuity": "04_visual_continuity/S011/SHOT_003.json"
  },
  "generation": {
    "provider": "vidu",
    "duration_seconds": 7.0,
    "aspect_ratio": "16:9",
    "resolution": "1080p",
    "mode": "reference_guided"
  },
  "actors": [
    {
      "actor_ref": "CHAR_JIEUN_001",
      "identity_type": "persistent",
      "identity_lock": true,
      "appearance": [
        "Oval face with soft features",
        "Natural eyebrows",
        "Dark brown eyes",
        "Light natural makeup",
        "Warm friendly expression",
        "Average height, slim build"
      ],
      "hair": [
        "Shoulder-length dark brown hair",
        "Straight with slight natural waves",
        "Tucked behind ears"
      ],
      "clothing": [
        "White casual t-shirt",
        "Light blue denim jacket",
        "Dark blue skinny jeans",
        "White sneakers",
        "Small silver earrings",
        "Simple wristwatch"
      ],
      "carried_items": [
        "Medium-sized travel backpack",
        "Small crossbody bag",
        "Smartphone",
        "Passport",
        "Checked suitcase"
      ],
      "body_state": [
        "Standing inside the moving subway train",
        "Holding onto a pole with one hand",
        "Looking out the window at the city passing by",
        "Backpack worn on back",
        "Crossbody bag worn across body",
        "Suitcase beside her"
      ],
      "emotion": "relieved and calm",
      "reference_asset_ids": [
        "ASSET_CHAR_JIEUN_PRIMARY_000001"
      ]
    }
  ],
  "location": {
    "location_ref": "LOC_AIRPORT_TRANSIT_001",
    "identity_lock": true,
    "current_zone": "Inside the subway train car, near a pole, looking out the window",
    "persistent_features": [
      "Transit station platforms",
      "Train or vehicle interior",
      "Views of urban landscape during the journey",
      "Signage for transit lines and stops"
    ],
    "orientation_state": [
      "Jieun standing inside the train car",
      "Jieun holding onto a pole with one hand",
      "Jieun facing the window, looking out at the city",
      "Suitcase beside Jieun",
      "Train windows on the sides",
      "Other passengers visible around Jieun"
    ],
    "reference_asset_ids": []
  },
  "props": [
    {
      "prop_id": "PROP_BACKPACK_001",
      "owner_ref": "CHAR_JIEUN_001",
      "state": "worn on back",
      "position": "on Jieun's back",
      "visible": true,
      "continuity_lock": true
    },
    {
      "prop_id": "PROP_CROSSBODY_BAG_001",
      "owner_ref": "CHAR_JIEUN_001",
      "state": "worn across body, closed",
      "position": "across Jieun's body",
      "visible": true,
      "continuity_lock": true
    },
    {
      "prop_id": "PROP_SMARTPHONE_001",
      "owner_ref": "CHAR_JIEUN_001",
      "state": "put away in crossbody bag",
      "position": "inside Jieun's crossbody bag",
      "visible": false,
      "continuity_lock": true
    },
    {
      "prop_id": "PROP_PASSPORT_001",
      "owner_ref": "CHAR_JIEUN_001",
      "state": "stored in crossbody bag",
      "position": "inside Jieun's crossbody bag",
      "visible": false,
      "continuity_lock": true
    },
    {
      "prop_id": "PROP_LUGGAGE_001",
      "owner_ref": "CHAR_JIEUN_001",
      "state": "beside Jieun",
      "position": "beside Jieun, on the train floor",
      "visible": true,
      "continuity_lock": true
    }
  ],
  "prompt": {
    "subject": "A young Korean woman with an oval face, soft features, natural eyebrows, dark brown eyes, and light natural makeup. She has shoulder-length dark brown hair, straight with slight natural waves, tucked behind her ears. She wears a white casual t-shirt, a light blue denim jacket, dark blue skinny jeans, white sneakers, small silver earrings, and a simple wristwatch. She carries a medium-sized travel backpack on her back, a small crossbody bag across her body, and a checked suitcase beside her. Her expression is relieved and calm.",
    "environment": "Inside a bright subway train car during the day, with natural daylight streaming through the windows. The train is moving with a rhythmic sound and slight sway. A few passengers are seated and standing, some reading books or looking at their phones. The train windows show views of the urban landscape passing by. Signage for transit lines and stops is visible inside the car.",
    "action": "Jieun nods with a relieved expression, puts her smartphone back into her crossbody bag, and looks out the window, watching for her stop. She remains standing, holding onto a pole with one hand, with her suitcase beside her.",
    "camera": "Medium shot, three-quarter angle, static camera with smooth stability.",
    "continuity": "Jieun has confirmed she is on the correct train toward Manhattan. She has put her phone away in her crossbody bag. She is now looking out the window, watching for her stop. Her backpack remains on her back, her crossbody bag is across her body, and her suitcase is beside her. Her expression is calm and relieved.",
    "final_prompt": "A young Korean woman with an oval face, soft features, natural eyebrows, dark brown eyes, and light natural makeup, with shoulder-length dark brown hair tucked behind her ears, wearing a white casual t-shirt, light blue denim jacket, dark blue skinny jeans, white sneakers, small silver earrings, and a simple wristwatch, stands inside a bright subway train car during the day. She has a medium-sized travel backpack on her back, a small crossbody bag across her body, and a checked suitcase beside her. She nods with a relieved expression, puts her smartphone into her crossbody bag, and looks out the window, watching for her stop, while holding onto a pole with one hand. The train car is bright with natural daylight streaming through the windows, with a few passengers seated and standing, and views of the urban landscape passing by outside. Medium shot, three-quarter angle, static camera with smooth stability. She has confirmed she is on the correct train toward Manhattan, has put her phone away, and is now watching for her stop, with her backpack, crossbody bag, and suitcase in place, and her expression calm and relieved."
  },
  "negative_constraints": [
    "Do not change character identity.",
    "Do not change canonical location identity.",
    "Do not introduce new characters.",
    "Do not introduce new locations.",
    "Do not alter canonical prop state.",
    "Do not change story events.",
    "Do not show Jieun moving past the subway journey or arriving at her stop.",
    "Do not show Jieun's smartphone in her hand.",
    "Do not show Jieun's suitcase being lost or missing.",
    "Do not show Jieun's passport or smartphone being dropped or lost.",
    "Do not show any problems or incidents with the subway ride.",
    "Do not show Jieun arriving at her hotel."
  ],
  "continuity": {
    "carry_in": [
      "Jieun has confirmed that the station names on the subway map match the ones on her phone's map",
      "She is holding her smartphone, looking satisfied"
    ],
    "carry_out": [
      "Jieun has confirmed she is on the correct train toward Manhattan",
      "She has put her phone away in her crossbody bag",
      "She is looking out the window, watching for her stop",
      "She feels relieved that she is on the right track"
    ],
    "must_match_previous_shot": true,
    "previous_scene_id": "S011",
    "previous_shot_id": "SHOT_002",
    "next_scene_id": "S012",
    "next_shot_id": "SHOT_001"
  }
}
