{
  "metadata": {
    "schema_version": "2.0",
    "content_version": "1.0",
    "revision": 1
  },
  "episode_id": "travel_new_york_city_ep001",
  "scene_id": "S002",
  "shot_id": "SHOT_001",
  "sequence": 1,
  "source_refs": {
    "production_scene": "02_visual/production_scenes/S002.json",
    "shot": "03_shots/S002/SHOT_001.json",
    "visual_continuity": "04_visual_continuity/S002/SHOT_001.json"
  },
  "generation": {
    "provider": "vidu",
    "duration_seconds": 6.0,
    "aspect_ratio": "16:9",
    "resolution": "1080p",
    "mode": "reference_guided"
  },
  "actors": [
    {
      "actor_ref": "CHAR_JIEUN_001",
      "identity_type": "persistent",
      "identity_lock": true,
      "appearance": [
        "Oval face with soft features",
        "Natural eyebrows",
        "Dark brown eyes",
        "Light natural makeup",
        "Warm friendly expression",
        "Average height, slim build"
      ],
      "hair": [
        "Shoulder-length dark brown hair",
        "Straight with slight natural waves",
        "Tucked behind ears"
      ],
      "clothing": [
        "White casual t-shirt",
        "Light blue denim jacket",
        "Dark blue skinny jeans",
        "White sneakers",
        "Small silver earrings",
        "Simple wristwatch"
      ],
      "carried_items": [
        "Medium-sized travel backpack",
        "Small crossbody bag",
        "Smartphone"
      ],
      "body_state": [
        "Standing in the immigration area of JFK terminal",
        "Backpack worn on back",
        "Crossbody bag worn across body",
        "Looking at the different lines and signage"
      ],
      "emotion": "a bit overwhelmed but curious",
      "reference_asset_ids": [
        "ASSET_CHAR_JIEUN_PRIMARY_000001"
      ]
    }
  ],
  "location": {
    "location_ref": "LOC_JFK_AIRPORT_001",
    "identity_lock": true,
    "current_zone": "immigration area, JFK International Airport",
    "persistent_features": [
      "Large terminal with high ceilings",
      "Digital flight information displays",
      "Signage for Arrivals, Immigration, and Baggage Claim",
      "Moving walkways and escalators",
      "Large windows with natural light"
    ],
    "orientation_state": [
      "Jieun facing the immigration lines and signage",
      "Immigration lines ahead of Jieun",
      "Airport employee area to Jieun's side",
      "Other passengers moving toward the immigration lines"
    ],
    "reference_asset_ids": []
  },
  "props": [
    {
      "prop_id": "PROP_BACKPACK_001",
      "owner_ref": "CHAR_JIEUN_001",
      "state": "worn on back",
      "position": "on Jieun's back",
      "visible": true,
      "continuity_lock": true
    },
    {
      "prop_id": "PROP_CROSSBODY_BAG_001",
      "owner_ref": "CHAR_JIEUN_001",
      "state": "worn across body",
      "position": "across Jieun's body",
      "visible": true,
      "continuity_lock": true
    },
    {
      "prop_id": "PROP_SMARTPHONE_001",
      "owner_ref": "CHAR_JIEUN_001",
      "state": "held in Jieun's hand",
      "position": "in Jieun's hand, lowered to her side",
      "visible": true,
      "continuity_lock": true
    }
  ],
  "prompt": {
    "subject": "Jieun, a young woman with an oval face, soft features, natural eyebrows, dark brown eyes, light natural makeup, and a warm friendly expression. She has shoulder-length dark brown hair, straight with slight natural waves, tucked behind ears. She wears a white casual t-shirt, light blue denim jacket, dark blue skinny jeans, white sneakers, small silver earrings, and a simple wristwatch. She carries a medium-sized travel backpack on her back, a small crossbody bag across her body, and holds a smartphone in her hand lowered to her side. She stands in the immigration area, looking at the different lines and signage, appearing a bit overwhelmed but curious.",
    "environment": "Inside JFK International Airport terminal, immigration area. The terminal has high ceilings, digital flight information displays, signage for Arrivals, Immigration, and Baggage Claim, moving walkways and escalators, and large windows with natural light. It is daytime with bright indoor terminal lighting. Other passengers are walking toward the immigration lines, and airport staff are guiding passengers.",
    "action": "Jieun stands in the immigration area, looking at the different lines and the signage above them. She appears uncertain about which line to join, with a mix of overwhelm and curiosity.",
    "camera": "Medium-wide shot, eye-level angle, static locked camera.",
    "continuity": "Jieun has just disembarked from the airplane and is inside the JFK terminal following signs toward immigration. She is wearing her travel outfit with backpack and crossbody bag, holding her smartphone. Her appearance, clothing, and carried items must remain consistent with the previous shot. She has not yet moved past the immigration area or interacted with anyone.",
    "final_prompt": "A medium-wide, eye-level static shot of Jieun, a young woman with shoulder-length dark brown hair tucked behind ears, wearing a white t-shirt, light blue denim jacket, dark blue skinny jeans, and white sneakers, with a travel backpack on her back and a crossbody bag across her body, holding a smartphone in her hand. She stands in the immigration area of JFK Airport terminal, surrounded by high ceilings, digital displays, and signage, with other passengers moving around. She looks at the different immigration lines and signage, appearing a bit overwhelmed but curious. The camera remains locked and static. Her appearance, clothing, and props remain unchanged from the previous shot."
  },
  "negative_constraints": [
    "Do not change Jieun's identity, appearance, hair, or clothing.",
    "Do not change the canonical location identity of JFK Airport immigration area.",
    "Do not introduce new characters.",
    "Do not introduce new locations.",
    "Do not alter the canonical prop state of the backpack, crossbody bag, or smartphone.",
    "Do not show Jieun moving past the immigration area.",
    "Do not show Jieun completing the immigration process.",
    "Do not show Jieun leaving the airport.",
    "Do not show any dialogue or interaction with other characters.",
    "Do not change story events or resolve unresolved story facts."
  ],
  "continuity": {
    "carry_in": [
      "Jieun has disembarked from the airplane",
      "She is now inside the JFK terminal, following signs toward immigration",
      "She feels a mix of excitement and nervousness"
    ],
    "carry_out": [
      "Jieun is standing in the immigration area looking at the lines",
      "She appears a bit overwhelmed"
    ],
    "must_match_previous_shot": true,
    "previous_scene_id": "S001",
    "previous_shot_id": "SHOT_003",
    "next_scene_id": "S002",
    "next_shot_id": "SHOT_002"
  }
}
